{
  "schema_version": "0.5.0",
  "case_ref": "CASE-0001",
  "reproduction_id": "REPRODUCTION-0001",
  "origin_ref": "MODEL:origin-alpha:v1",
  "derivative_ref": "MODEL:student-beta:v1",
  "target_record_type": "evidence",
  "target_record_ref": "EVIDENCE-0001",
  "challenge_refs": [
    "CHALLENGE-0001"
  ],
  "reproduction_type": "independent_replication",
  "method": "Independent execution of the declared watermark detector under controlled sampling conditions.",
  "method_ref": "METHOD:watermark-reproduction-v1",
  "input_refs": [
    "ARTIFACT:probe-set-specification-v1",
    "ARTIFACT:detector-config-0001",
    "CALIBRATION:watermark-detector-v1"
  ],
  "environment": {
    "detector_version": "1.0.0",
    "sample_count": 120,
    "threshold": 4.0,
    "operator_domain": "independent"
  },
  "performed_by": "AUDITOR:independent-reproduction-node",
  "independent_operator": true,
  "outcome": "not_reproduced",
  "result_summary": [
    "the reproduction produced a z-score of 1.63",
    "the original watermark signal was not reproduced",
    "the result was treated as additional counter-evidence"
  ],
  "produced_evidence_refs": [
    "EVIDENCE-0005"
  ],
  "limitations": [
    "one failed reproduction is insufficient to prove that the original observation was erroneous"
  ],
  "performed_at": "2026-09-07T01:05:00Z",
  "integrity": {
    "algorithm": "sha256",
    "digest": "ffffffffffffffffffffffffffffffffffffffffffffffffffffffffffffffff"
  }
}
